{
  "$schema": "../schemas/status.schema.json",
  "schemaVersion": 1,
  "updatedAt": "2026-08-03",
  "currentPhase": "phase-07",
  "currentSlice": "Alpha release review and publication",
  "health": "yellow",
  "summary": "The default declarative TypeScript macro compiler, CLI, external workflow, and reproducible alpha artifacts are complete and verified locally. npm publication and Git-tag creation are not authorized.",
  "currentTask": "REL-004",
  "tasks": [
    {
      "id": "FND-001",
      "title": "Create the workspace",
      "phase": "phase-00",
      "status": "done",
      "order": 1,
      "owner": "Codex",
      "branch": null,
      "prerequisites": [],
      "specifications": [
        "docs/specifications/01-compiler-architecture.md#1-repository-layout"
      ],
      "nextAction": "Task complete. Preserve the package boundaries while adding shared infrastructure."
    },
    {
      "id": "FND-002",
      "title": "Establish shared IDs and results",
      "phase": "phase-00",
      "status": "done",
      "order": 2,
      "owner": "Codex",
      "branch": null,
      "prerequisites": ["FND-001"],
      "specifications": [
        "docs/specifications/01-compiler-architecture.md#4-core-package-apis"
      ],
      "nextAction": "Task complete. Reuse these shared primitives in diagnostics and later compiler packages."
    },
    {
      "id": "FND-003",
      "title": "Establish diagnostics",
      "phase": "phase-00",
      "status": "done",
      "order": 3,
      "owner": "Codex",
      "branch": null,
      "prerequisites": ["FND-002"],
      "specifications": [
        "docs/specifications/01-compiler-architecture.md#8-diagnostics-ownership"
      ],
      "nextAction": "Task complete. Register package diagnostics through this shared model."
    },
    {
      "id": "FND-004",
      "title": "Build the fixture harness",
      "phase": "phase-00",
      "status": "done",
      "order": 4,
      "owner": "Codex",
      "branch": null,
      "prerequisites": ["FND-001", "FND-003"],
      "specifications": [
        "docs/specifications/05-test-architecture.md#2-fixture-layout"
      ],
      "nextAction": "Task complete. Use the harness for conformance and playground-derived acceptance cases."
    },
    {
      "id": "FND-005",
      "title": "Import the legacy corpus",
      "phase": "phase-00",
      "status": "done",
      "order": 5,
      "owner": "Codex",
      "branch": null,
      "prerequisites": ["FND-004"],
      "specifications": ["docs/proposals/00-expressiveness-contract.md"],
      "nextAction": "Task complete. Keep every acceptance contract and capability mapping current as implementation changes."
    },
    {
      "id": "FND-006",
      "title": "Resolve blocking decisions",
      "phase": "phase-00",
      "status": "done",
      "order": 6,
      "owner": "Codex",
      "branch": null,
      "prerequisites": ["FND-005"],
      "specifications": ["docs/specifications/README.md#unresolved-decisions"],
      "nextAction": "Task complete. ADR-0002 through ADR-0006 are accepted; preserve their contracts in specifications and release gates."
    },
    {
      "id": "SYN-001",
      "title": "Implement syntax primitives",
      "phase": "phase-01",
      "status": "done",
      "order": 101,
      "owner": "Codex",
      "branch": null,
      "prerequisites": ["FND-002"],
      "specifications": [
        "docs/specifications/02-syntax-objects-hygiene.md#1-syntax-representation"
      ],
      "nextAction": "Task complete. Preserve these invariants in reader and template constructors."
    },
    {
      "id": "SYN-002",
      "title": "Implement origins",
      "phase": "phase-01",
      "status": "done",
      "order": 102,
      "owner": "Codex",
      "branch": null,
      "prerequisites": ["SYN-001"],
      "specifications": [
        "docs/specifications/02-syntax-objects-hygiene.md#2-origin-model"
      ],
      "nextAction": "Task complete. Use this store for reader, template, trace, and diagnostic origins."
    },
    {
      "id": "SYN-003",
      "title": "Implement syntax cursors",
      "phase": "phase-01",
      "status": "done",
      "order": 103,
      "owner": "Codex",
      "branch": null,
      "prerequisites": ["SYN-001"],
      "specifications": [
        "docs/specifications/02-syntax-objects-hygiene.md#1-syntax-representation"
      ],
      "nextAction": "Task complete. Use cursor location identities and ranges in readers and declarative matchers."
    },
    {
      "id": "RDR-001",
      "title": "Build the TypeScript scanner adapter",
      "phase": "phase-01",
      "status": "done",
      "order": 104,
      "owner": "Codex",
      "branch": null,
      "prerequisites": ["SYN-001"],
      "specifications": [
        "docs/proposals/01-syntax-data-reader.md",
        "docs/tasks/phase-01-reader.md#rdr-001-build-the-typescript-scanner-adapter"
      ],
      "nextAction": "Task complete. Keep all TypeScript compiler API and enum dependencies inside the version adapter."
    },
    {
      "id": "RDR-002",
      "title": "Implement template modes",
      "phase": "phase-01",
      "status": "done",
      "order": 105,
      "owner": "Codex",
      "branch": null,
      "prerequisites": ["RDR-001"],
      "specifications": [
        "docs/tasks/phase-01-reader.md#rdr-002-implement-template-modes"
      ],
      "nextAction": "Task complete. Preserve the iterative substitution stack when JSX expressions embed templates."
    },
    {
      "id": "RDR-003",
      "title": "Implement JSX modes",
      "phase": "phase-01",
      "status": "done",
      "order": 106,
      "owner": "Codex",
      "branch": null,
      "prerequisites": ["RDR-001"],
      "specifications": [
        "docs/tasks/phase-01-reader.md#rdr-003-implement-jsx-modes"
      ],
      "nextAction": "Task complete. Use the lexical-mode annotations when constructing JSX containers and diagnostics."
    },
    {
      "id": "RDR-004",
      "title": "Build delimiter trees",
      "phase": "phase-01",
      "status": "done",
      "order": 107,
      "owner": "Codex",
      "branch": null,
      "prerequisites": ["RDR-002", "RDR-003", "SYN-002"],
      "specifications": [
        "docs/tasks/phase-01-reader.md#rdr-004-build-delimiter-trees"
      ],
      "nextAction": "Task complete. Preserve RootSyntax and recovery invariants in printing and incremental reads."
    },
    {
      "id": "RDR-005",
      "title": "Implement lossless printing",
      "phase": "phase-01",
      "status": "done",
      "order": 108,
      "owner": "Codex",
      "branch": null,
      "prerequisites": ["RDR-004"],
      "specifications": [
        "docs/tasks/phase-01-reader.md#rdr-005-implement-lossless-printing"
      ],
      "nextAction": "Task complete. Use print equality as an invariant for incremental reads and corpus benchmarks."
    },
    {
      "id": "RDR-006",
      "title": "Add incremental API baseline",
      "phase": "phase-01",
      "status": "done",
      "order": 109,
      "owner": "Codex",
      "branch": null,
      "prerequisites": ["RDR-004"],
      "specifications": [
        "docs/tasks/phase-01-reader.md#rdr-006-add-incremental-api-baseline"
      ],
      "nextAction": "Task complete. Replace clean-read strategy with reuse only after Phase 7 profiling identifies profitable stable subtrees."
    },
    {
      "id": "RDR-007",
      "title": "Run corpora and benchmark",
      "phase": "phase-01",
      "status": "done",
      "order": 110,
      "owner": "Codex",
      "branch": null,
      "prerequisites": ["RDR-005", "RDR-006", "FND-005"],
      "specifications": [
        "docs/tasks/phase-01-reader.md#rdr-007-run-corpora-and-benchmark"
      ],
      "nextAction": "Task complete. Preserve corpus gates; profile the documented 1.44-3.16 MiB/s baseline in PRF-001 without removing required syntax data."
    },
    {
      "id": "PAT-001",
      "title": "Define pattern and capture ASTs",
      "phase": "phase-02",
      "status": "done",
      "order": 201,
      "owner": "Codex",
      "branch": null,
      "prerequisites": ["SYN-003"],
      "specifications": [
        "docs/specifications/03-patterns-templates.md#1-pattern-ast",
        "docs/tasks/phase-02-patterns.md#pat-001-define-pattern-and-capture-asts"
      ],
      "nextAction": "Task complete. Use the constructors in MCL-001 and preserve stable capture and repetition IDs during parsing."
    },
    {
      "id": "MCL-001",
      "title": "Parse structural macro definitions",
      "phase": "phase-02",
      "status": "done",
      "order": 202,
      "owner": "Codex",
      "branch": null,
      "prerequisites": ["PAT-001", "RDR-004"],
      "specifications": [
        "docs/tasks/phase-02-patterns.md#mcl-001-parse-structural-macro-definitions"
      ],
      "nextAction": "Task complete. Feed parsed rule patterns into PAT-002 while retaining templates and semantic clauses as lossless syntax."
    },
    {
      "id": "PAT-002",
      "title": "Infer and validate capture shapes",
      "phase": "phase-02",
      "status": "done",
      "order": 203,
      "owner": "Codex",
      "branch": null,
      "prerequisites": ["PAT-001", "MCL-001"],
      "specifications": [
        "docs/tasks/phase-02-patterns.md#pat-002-infer-and-validate-capture-shapes"
      ],
      "nextAction": "Task complete. Compile only diagnostic-free pattern and shape results in PAT-003."
    },
    {
      "id": "PAT-003",
      "title": "Compile matcher programs",
      "phase": "phase-02",
      "status": "done",
      "order": 204,
      "owner": "Codex",
      "branch": null,
      "prerequisites": ["PAT-002"],
      "specifications": [
        "docs/specifications/03-patterns-templates.md#7-matcher-program",
        "docs/tasks/phase-02-patterns.md#pat-003-compile-matcher-programs"
      ],
      "nextAction": "Task complete. Execute these immutable programs with cursor and capture rollback in PAT-004."
    },
    {
      "id": "PAT-004",